{
  "schemaVersion": "1.0",
  "runId": "dictation-parity-1774023592299",
  "generatedAt": "2026-03-20T16:19:52.298Z",
  "build": {
    "version": "nautilus-dev",
    "commit": "c1c4921"
  },
  "platform": {
    "os": "macOS",
    "osVersion": "26.4",
    "device": "Apple M4 Pro"
  },
  "rows": [
    {
      "timestamp": "2026-03-20T16:19:52.298Z",
      "appTarget": "Apple Notes",
      "requestedProvider": "distil_whisper",
      "actualProvider": "distil_whisper",
      "isFallback": false,
      "fallbackReason": null,
      "transcriptionLatencyMs": 145.0,
      "endToEndMs": 260.0,
      "insertionOutcome": "pasted",
      "insertionModeUsed": "paste",
      "commandApplied": null,
      "snippetAppliedCount": 0
    },
    {
      "timestamp": "2026-03-20T16:19:52.298Z",
      "appTarget": "Google Docs",
      "requestedProvider": "distil_whisper",
      "actualProvider": "distil_whisper",
      "isFallback": false,
      "fallbackReason": null,
      "transcriptionLatencyMs": 132.0,
      "endToEndMs": 240.0,
      "insertionOutcome": "pasted",
      "insertionModeUsed": "command_only",
      "commandApplied": "newline",
      "snippetAppliedCount": 0
    },
    {
      "timestamp": "2026-03-20T16:19:52.298Z",
      "appTarget": "Google Docs",
      "requestedProvider": "distil_whisper",
      "actualProvider": "distil_whisper",
      "isFallback": false,
      "fallbackReason": null,
      "transcriptionLatencyMs": 132.0,
      "endToEndMs": 244.0,
      "insertionOutcome": "pasted",
      "insertionModeUsed": "command_only",
      "commandApplied": "paragraph",
      "snippetAppliedCount": 0
    },
    {
      "timestamp": "2026-03-20T16:19:52.298Z",
      "appTarget": "Slack",
      "requestedProvider": "voxtral",
      "actualProvider": "distil_whisper",
      "isFallback": true,
      "fallbackReason": "provider_unavailable",
      "transcriptionLatencyMs": 150.0,
      "endToEndMs": 286.0,
      "insertionOutcome": "pasted",
      "insertionModeUsed": "paste",
      "commandApplied": null,
      "snippetAppliedCount": 1
    },
    {
      "timestamp": "2026-03-20T16:19:52.298Z",
      "appTarget": "Notion",
      "requestedProvider": "distil_whisper",
      "actualProvider": "distil_whisper",
      "isFallback": false,
      "fallbackReason": null,
      "transcriptionLatencyMs": 151.0,
      "endToEndMs": 284.0,
      "insertionOutcome": "pasted",
      "insertionModeUsed": "paste",
      "commandApplied": null,
      "snippetAppliedCount": 0
    },
    {
      "timestamp": "2026-03-20T16:19:52.298Z",
      "appTarget": "Cursor",
      "requestedProvider": "distil_whisper",
      "actualProvider": "distil_whisper",
      "isFallback": false,
      "fallbackReason": null,
      "transcriptionLatencyMs": 164.0,
      "endToEndMs": 300.0,
      "insertionOutcome": "pasted",
      "insertionModeUsed": "command_only",
      "commandApplied": "rewrite_professional",
      "snippetAppliedCount": 0
    },
    {
      "timestamp": "2026-03-20T16:19:52.298Z",
      "appTarget": "VS Code",
      "requestedProvider": "distil_whisper",
      "actualProvider": "distil_whisper",
      "isFallback": false,
      "fallbackReason": null,
      "transcriptionLatencyMs": 166.0,
      "endToEndMs": 305.0,
      "insertionOutcome": "pasted",
      "insertionModeUsed": "command_only",
      "commandApplied": "bulletize_selection",
      "snippetAppliedCount": 0
    },
    {
      "timestamp": "2026-03-20T16:19:52.298Z",
      "appTarget": "Messages",
      "requestedProvider": "distil_whisper",
      "actualProvider": "distil_whisper",
      "isFallback": false,
      "fallbackReason": null,
      "transcriptionLatencyMs": 138.0,
      "endToEndMs": 248.0,
      "insertionOutcome": "pasted",
      "insertionModeUsed": "paste",
      "commandApplied": null,
      "snippetAppliedCount": 0
    }
  ],
  "summary": {
    "sampleCount": 8,
    "insertionSuccessRate": 1.0,
    "commandSuccessRate": 1.0,
    "snippetSuccessRate": 1.0,
    "p50EndToEndMs": 260.0,
    "p95EndToEndMs": 305.0
  }
}
